[
  {
    "id": "SCREEN-TASK-DASHBOARD",
    "title": "AI Task Copilot Dashboard",
    "route": "/tasks",
    "layout_archetype": "dashboard",
    "requirement_ids": [
      "REQ-001.1",
      "REQ-001.2"
    ],
    "journey_stage": "Discovery & Initiation",
    "user_flow_step": "FLOW-CREATE-TASK: Step 1 & 2",
    "components": [
      "COMP-TASK-CREATOR",
      "COMP-TASK-LIST",
      "COMP-STATUS-BADGE"
    ],
    "wireframe": {
      "header": "Top navigation bar with workspace switcher and SDLC health indicator",
      "sidebar": "Filter by tags, status (todo, in-progress, completed), and assigned agent",
      "main_content": "Task creation form followed by responsive task grid cards",
      "footer": "System status bar displaying contract verification hash and active gates"
    },
    "error_handling": {
      "network_failure": "Displays persistent offline banner with cached task access",
      "validation_error": "Inline red banner mapping RFC 7807 error detail to input field",
      "empty_state": "Renders empty state illustration with single CTA to create first task"
    },
    "responsive_adaptations": {
      "mobile": "Single column layout, collapsible filters, bottom action sheet",
      "desktop": "Multi-column dashboard with persistent sidebar and real-time activity stream"
    }
  },
  {
    "id": "SCREEN-TASK-DETAILS",
    "title": "Task Decomposition & Evidence Inspector",
    "route": "/tasks/:id",
    "layout_archetype": "master-detail",
    "requirement_ids": [
      "REQ-001.3"
    ],
    "journey_stage": "Verification & Review",
    "user_flow_step": "FLOW-REVIEW-EVIDENCE: Step 1 & 2",
    "components": [
      "COMP-EVAL-CARD",
      "COMP-STATUS-BADGE",
      "COMP-DELETE-MODAL"
    ],
    "wireframe": {
      "header": "Breadcrumbs navigation with back-to-dashboard CTA and status pill",
      "main_content": "Split panel: left side shows task specification; right side shows verification evidence",
      "footer": "Execution toolbar with rollback button, re-verify CTA, and delete action"
    },
    "error_handling": {
      "network_failure": "Retry button with exponential backoff indicator",
      "validation_error": "Detailed RFC 7807 dialog with stack trace and spec cross-reference",
      "empty_state": "Placeholder card: \"No AI evaluation benchmark recorded yet.\""
    },
    "responsive_adaptations": {
      "mobile": "Tabbed interface alternating between Specification and Verification evidence",
      "desktop": "Side-by-side synchronized scroll view with active gate checklist"
    }
  }
]